source_id,country,title,url,source_type,raw_documentation_category,accessed,used_for,stored_in,notes
RU-S005,Russia,Attestation webinar page,https://minobrnauki.gov.ru/press-center/news/nauka-i-obrazovanie/99016/,Website,reports and monitoring,2026-04-22,Russia deep dossier,data/Russia/raw documentation/source notes/Russia deep-dive sources.md,"Used for the dissertation-council monitoring and digitalization layer."
RU-S006,Russia,VAK plenary meeting page,https://minobrnauki.gov.ru/press-center/news/nauka-i-obrazovanie/100193/,Website,research integrity offices and bodies,2026-04-22,Russia deep dossier,data/Russia/raw documentation/source notes/Russia deep-dive sources.md,"Current ministry-facing page showing VAK's continuing centrality."
RU-S007,Russia,Independent degree-awarding organizations page,https://minobrnauki.gov.ru/press-center/news/novosti-ministerstva/76985/,Website,research integrity offices and bodies,2026-04-22,Russia deep dossier,data/Russia/raw documentation/source notes/Russia deep-dive sources.md,"Key official source for the autonomous degree-awarding route."
RU-S008,Russia,VAK 90th anniversary page,https://www.minobrnauki.gov.ru/press-center/news/novosti-ministerstva/74155/,Website,reports and monitoring,2026-04-22,Russia deep dossier,data/Russia/raw documentation/source notes/Russia deep-dive sources.md,"Used to support the continuing public role of VAK in state scientific attestation."
RU-S009,Russia,VAK main portal,https://vak.minobrnauki.gov.ru/main,Website,research integrity offices and bodies,2026-04-22,Russia deep dossier,data/Russia/raw documentation/source notes/Russia deep-dive sources.md,"Core official attestation portal; access was intermittent in this pass."
RU-S010,Russia,VAK documents and editions tab,https://vak.minobrnauki.gov.ru/documents#tab=_tab:editions~,Website,misconduct procedures,2026-04-22,Russia deep dossier,data/Russia/raw documentation/source notes/Russia deep-dive sources.md,"Official portal location for documents and reviewed-journal visibility; current live access should be rechecked."
RU-S011,Russia,VAK dissertation-councils tab,https://vak.minobrnauki.gov.ru/dc#tab=_tab:dc~,Website,misconduct procedures,2026-04-22,Russia deep dossier,data/Russia/raw documentation/source notes/Russia deep-dive sources.md,"Official portal location for dissertation-council visibility; current live access was unstable."
RU-S012,Russia,RAS ethics council page,https://new.ras.ru/structures/komitety-sovety-i-komissii/komitety-sovety-i-komissii-pri-prezidiume-ran/sovety/sovet-po-etike-nauchnykh-issledovaniy/,Website,research integrity offices and bodies,2026-04-22,Russia deep dossier,data/Russia/raw documentation/source notes/Russia deep-dive sources.md,"Main official academy page for the new ethics council."
RU-S013,Russia,RAS code-development news,https://new.ras.ru/press-center/news/kodeks-etiki-v-sfere-nauchnykh-issledovaniy-razrabotayut-v-ran/,Website,national policies and guidance,2026-04-22,Russia deep dossier,data/Russia/raw documentation/source notes/Russia deep-dive sources.md,"Used to show that the academy ethics-code layer is still being built in 2026."
RU-S014,Russia,RAS anti-falsification commission page,https://new.ras.ru/structures/komitety-sovety-i-komissii/nauchnye-komissii/komissiya-ran-po-protivodeystviyu-falsifikatsii-nauchnykh-issledovaniy/,Website,research integrity offices and bodies,2026-04-22,Russia deep dossier,data/Russia/raw documentation/source notes/Russia deep-dive sources.md,"Main official academy source for the anti-falsification route."
RU-S015,Russia,ANRI ethics council page,https://rassep.ru/sovet-po-etike/,Website,research integrity offices and bodies,2026-04-22,Russia deep dossier,data/Russia/raw documentation/source notes/Russia deep-dive sources.md,"Professional publication-ethics route."
RU-S016,Russia,ANRI publication-ethics declaration page,https://rassep.ru/novosti-i-meropriyatiya/deklaratsiya-eticheskie-printsipy-nauchnykh-publikatsiy/,Website,national policies and guidance,2026-04-22,Russia deep dossier,data/Russia/raw documentation/source notes/Russia deep-dive sources.md,"Used to map the professional declaration layer for publication ethics."
RU-S017,Russia,HSE code of conduct,https://www.hse.ru/en/info/code-of-conduct,Website,institutional procedures,2026-04-22,Russia deep dossier,data/Russia/raw documentation/source notes/Russia deep-dive sources.md,"Institutional conduct baseline for one of the clearest local university routes."
RU-S018,Russia,HSE IRB page,https://www.hse.ru/en/org/hse/irb/,Website,institutional procedures,2026-04-22,Russia deep dossier,data/Russia/raw documentation/source notes/Russia deep-dive sources.md,"Public university route for human-participant ethics review."
RU-S019,Russia,HSE ethics-violations page,https://www.hse.ru/en/our/news/452136460.html,Website,institutional procedures,2026-04-22,Russia deep dossier,data/Russia/raw documentation/source notes/Russia deep-dive sources.md,"Used to show local reporting and ethics categories at institutional level."
RU-S020,Russia,MSU bioethics approval page,https://bioethics.msu.ru/approval/1.html,Website,institutional procedures,2026-04-22,Russia deep dossier,data/Russia/raw documentation/source notes/Russia deep-dive sources.md,"Institutional biomedical-review route at Moscow State University."
RU-S021,Russia,MSU bioethics annual report 2023-2024,https://bioethics.msu.ru/sets/protocols/%D0%9E%D1%82%D1%87%D1%91%D1%82_163-%D0%B4-%D0%B7_%D0%B7%D0%B0_2023-2024_20.05.2024.pdf,PDF,reports and monitoring,2026-04-22,Russia deep dossier,data/Russia/raw documentation/source notes/Russia deep-dive sources.md,"Rare public reporting source from an institutional ethics committee."
RU-S022,Russia,Ministry of Health ethics-council announcement,https://minzdrav.gov.ru/en/special/news/2024/11/02/21879-minzdrav-rossii-ob-yavlyaet-nabor-kandidatov-na-vklyuchenie-v-sovet-po-etike,Website,ethics and boundary regimes,2026-04-22,Russia deep dossier,data/Russia/raw documentation/source notes/Russia deep-dive sources.md,"Best public national clinical-ethics trace found in this pass."
RU-S023,Russia,Roszdravnadzor clinical-studies control page,https://roszdravnadzor.gov.ru/drugs/controllslp,Website,ethics and boundary regimes,2026-04-22,Russia deep dossier,data/Russia/raw documentation/source notes/Russia deep-dive sources.md,"Main regulator route for clinical studies of medicinal products."
RU-S024,Russia,Roszdravnadzor Order No. 706n PDF,https://roszdravnadzor.gov.ru/i/upload/images/2025/4/8/1744060465.0132-1-3939573.pdf,PDF,ethics and boundary regimes,2026-04-22,Russia deep dossier,data/Russia/raw documentation/source notes/Russia deep-dive sources.md,"Used to strengthen the clinical-study oversight trail."
RU-S025,Russia,RSF about page,https://rscf.ru/en/about/,Website,funder requirements,2026-04-22,Russia deep dossier,data/Russia/raw documentation/source notes/Russia deep-dive sources.md,"Used to place RSF in the national funder layer."
RU-S026,Russia,RSF position-paper news page,https://www.rscf.ru/en/news/en-57/rsf-position-paper/,Website,funder requirements,2026-04-22,Russia deep dossier,data/Russia/raw documentation/source notes/Russia deep-dive sources.md,"Announcement page for the RSF position paper on ethics of animal use."
RU-S027,Russia,RSF position paper on ethics of animal use,https://rscf.ru/fondfiles/PotE_eng.pdf,PDF,funder requirements,2026-04-22,Russia deep dossier,data/Russia/raw documentation/source notes/Russia deep-dive sources.md,"Key funder and animal-ethics source."
RU-S028,Russia,Roskomnadzor home page,https://rkn.gov.ru/,Website,ethics and boundary regimes,2026-04-22,Russia deep dossier,data/Russia/raw documentation/source notes/Russia deep-dive sources.md,"Boundary authority for personal-data compliance."
RU-S029,Russia,Rospatent statute page,https://rospatent.gov.ru/en/statute,Website,ethics and boundary regimes,2026-04-22,Russia deep dossier,data/Russia/raw documentation/source notes/Russia deep-dive sources.md,"Boundary authority for intellectual-property administration."
ME-S001,Montenegro,Law on Scientific Research Activity,https://www.gov.me/en/documents/dd3251ce-3ead-4b78-97bc-f9f0af60fbdd,Website,law references,2026-04-22,Montenegro deep dossier,data/Montenegro/raw documentation/source notes/Montenegro deep-dive sources.md,"Core law page for the research-governance lane."
ME-S002,Montenegro,Scientific research law PDF,https://wapi.gov.me/download/da289df3-d90e-4048-999e-b55a226253d9?version=1.0,PDF,law references,2026-04-22,Montenegro deep dossier,data/Montenegro/raw documentation/source notes/Montenegro deep-dive sources.md,"Main PDF source for the 2025 research law."
ME-S003,Montenegro,Law on Higher Education,https://www.gov.me/en/documents/ad155ad9-bc62-453f-8cbf-1e58537b4f45,Website,law references,2026-04-22,Montenegro deep dossier,data/Montenegro/raw documentation/source notes/Montenegro deep-dive sources.md,"Higher-education law source for academic freedoms, codes of ethics and quality assurance."
ME-S004,Montenegro,Law on Academic Integrity,https://www.gov.me/en/documents/5825374f-0da5-41df-8d52-f9273d88a44b,Website,law references,2026-04-22,Montenegro deep dossier,data/Montenegro/raw documentation/source notes/Montenegro deep-dive sources.md,"Core procedural law for the academic-integrity lane."
ME-S005,Montenegro,Legislative and Strategic Framework page,https://www.gov.me/en/mps/legislative-and-strategic-framework-for-the-areas-of-education-science-and-innovation,Website,national policies and guidance,2026-04-22,Montenegro deep dossier,data/Montenegro/raw documentation/source notes/Montenegro deep-dive sources.md,"Best ministry source-discovery page for laws, strategies, rules and forms."
ME-S006,Montenegro,Council for Scientific Research Activity page,https://www.gov.me/mps/savjeti-za-oblasti-obrazovanja-nauke-i-inovacija/savjet-za-naucnoistrazivacku-djelatnost,Website,research integrity offices and bodies,2026-04-22,Montenegro deep dossier,data/Montenegro/raw documentation/source notes/Montenegro deep-dive sources.md,"National advisory body for the research-system lane."
ME-S007,Montenegro,Strategy for Scientific Research Activity 2024-2028,https://www.gov.me/en/documents/e0c75f8f-f975-4e6f-a6fb-0ba0a336f9c5,Website,national policies and guidance,2026-04-22,Montenegro deep dossier,data/Montenegro/raw documentation/source notes/Montenegro deep-dive sources.md,"Main strategic source for the research-governance layer."
ME-S008,Montenegro,Open Science Programme article,https://www.gov.me/en/article/229855--programme-of-implementation-of-open-science-principles-in-montenegro-with-the-action-plan-2020-2022-adopted,Website,open science and data,2026-04-22,Montenegro deep dossier,data/Montenegro/raw documentation/source notes/Montenegro deep-dive sources.md,"Used to place open science inside the integrity and research-culture layer."
ME-S009,Montenegro,Licensed scientific research institutions dataset,https://data.gov.me/dataset/lista-licenciranih-naucno-istrazivackih-ustanova,Website,open science and data,2026-04-22,Montenegro deep dossier,data/Montenegro/raw documentation/source notes/Montenegro deep-dive sources.md,"Open-data route for the licensed-institutions register."
ME-S010,Montenegro,Ethics Committee page,https://www.gov.me/mps/resor-prosvjete/eticki-komitet,Website,research integrity offices and bodies,2026-04-22,Montenegro deep dossier,data/Montenegro/raw documentation/source notes/Montenegro deep-dive sources.md,"Main public route for the national academic-integrity committee."
ME-S011,Montenegro,Ethics Committee members document,https://www.gov.me/dokumenta/4a8dd476-eac6-4949-8ea7-2489e2d54f3c,Website,research integrity offices and bodies,2026-04-22,Montenegro deep dossier,data/Montenegro/raw documentation/source notes/Montenegro deep-dive sources.md,"Current composition source for the national committee."
ME-S012,Montenegro,Ethics Committee rules of procedure,https://www.gov.me/dokumenta/9a9fa22e-306e-4e47-8e52-c60c67338b7e,Website,misconduct procedures,2026-04-22,Montenegro deep dossier,data/Montenegro/raw documentation/source notes/Montenegro deep-dive sources.md,"Procedural source for the national committee."
ME-S013,Montenegro,Ethics Committee 2025 annual report page,https://www.gov.me/clanak/izvjestaj-o-radu-treceg-saziva-etickog-komiteta-za-2025-godinu,Website,reports and monitoring,2026-04-22,Montenegro deep dossier,data/Montenegro/raw documentation/source notes/Montenegro deep-dive sources.md,"Public page announcing the 2025 annual report."
ME-S014,Montenegro,Ethics Committee 2025 annual report PDF,https://wapi.gov.me/download/11e0e41b-2d82-4076-882b-5c1ef9b3e460?version=1.0,PDF,reports and monitoring,2026-04-22,Montenegro deep dossier,data/Montenegro/raw documentation/source notes/Montenegro deep-dive sources.md,"Formal annual report confirming current committee activity."
ME-S015,Montenegro,Ethics Committee XII session page,https://www.gov.me/clanak/odrzana-xii-sjednica-etickog-komiteta,Website,reports and monitoring,2026-04-22,Montenegro deep dossier,data/Montenegro/raw documentation/source notes/Montenegro deep-dive sources.md,"Used to show current committee practice in March 2026."
ME-S016,Montenegro,Ethics Committee decision of 2 April 2026,https://www.gov.me/clanak/odluka-etickog-komiteta-donesena-na-sjednici-2-aprila-2026-godine,Website,misconduct procedures,2026-04-22,Montenegro deep dossier,data/Montenegro/raw documentation/source notes/Montenegro deep-dive sources.md,"Current public decision trace for the national committee."
ME-S017,Montenegro,AKOKVO rules on reaccreditation with Standard 11,https://akokvo.me/wp-content/uploads/2023/11/Rules-on-reaccreditation-with-forms_2023.pdf,PDF,misconduct procedures,2026-04-22,Montenegro deep dossier,data/Montenegro/raw documentation/source notes/Montenegro deep-dive sources.md,"Core source for the integrity-through-accreditation layer."
ME-S018,Montenegro,Higher Education Institutions page,https://akokvo.me/en/higher-education-institutions/,Website,reports and monitoring,2026-04-22,Montenegro deep dossier,data/Montenegro/raw documentation/source notes/Montenegro deep-dive sources.md,"Used to map the current institutional landscape and student concentration."
ME-S019,Montenegro,AKOKVO-Ethics Committee cooperation agreement page,https://akokvo.me/en/cooperation-agreement-signed-between-the-agency-for-control-and-quality-assurance-of-higher-education-and-the-ethics-committee/,Website,reports and monitoring,2026-04-22,Montenegro deep dossier,data/Montenegro/raw documentation/source notes/Montenegro deep-dive sources.md,"Key source for the academic-integrity standard rollout."
ME-S020,Montenegro,AKOKVO GAIN article,https://akokvo.me/en/akokvo-becomes-a-member-of-the-global-academic-integrity-network-gain/,Website,reports and monitoring,2026-04-22,Montenegro deep dossier,data/Montenegro/raw documentation/source notes/Montenegro deep-dive sources.md,"Used to confirm implementation of the pilot academic-integrity standard in the second cycle."
ME-S021,Montenegro,University of Montenegro Code of Ethics,https://www.ucg.ac.me/skladiste/blog_6/objava_159200/fajlovi/02-0302%20Code%20of%20Ethics%20of%20the%20UoM.pdf,PDF,codes of conduct,2026-04-22,Montenegro deep dossier,data/Montenegro/raw documentation/source notes/Montenegro deep-dive sources.md,"Main local normative source for the public-university route."
ME-S022,Montenegro,University of Montenegro academic-integrity rulebook,https://www.ucg.ac.me/skladiste/blog_6/objava_158387/fajlovi/03-3502%20Rulebook%20on%20Determination%20of%20Violation%20of%20Academic%20Integrity%20on%20the%20UoM.pdf,PDF,institutional procedures,2026-04-22,Montenegro deep dossier,data/Montenegro/raw documentation/source notes/Montenegro deep-dive sources.md,"Main local procedure source for the University of Montenegro."
ME-S023,Montenegro,University of Montenegro HRS4R Review,https://ucg.ac.me/skladiste/blog_17/objava_39887/fajlovi/HRS4R%20Review%2C%20October%202025.pdf,PDF,reports and monitoring,2026-04-22,Montenegro deep dossier,data/Montenegro/raw documentation/source notes/Montenegro deep-dive sources.md,"Used to map the integrity-plan, glossary and policy-development layer."
ME-S024,Montenegro,University of Montenegro plagiarism-software decision,https://www.ucg.ac.me/skladiste/blog_1012/objava_5/fajlovi/15%20decision%20on%20use%20of%20SOFTWARE%20FOR%20PLAGIARSIM%20DETECTION.pdf,PDF,institutional procedures,2026-04-22,Montenegro deep dossier,data/Montenegro/raw documentation/source notes/Montenegro deep-dive sources.md,"Technical-authenticity control source for the institutional layer."
ME-S025,Montenegro,Mediterranean University legal regulations page,https://unimediteran.net/univerzitet/legal-regulations/?lang=en,Website,institutional procedures,2026-04-22,Montenegro deep dossier,data/Montenegro/raw documentation/source notes/Montenegro deep-dive sources.md,"Best public page for the private-university ethics and citation document set."
ME-S026,Montenegro,UM Statute,https://unimediteran.net/wp-content/uploads/2024/10/UM_STATUTE.pdf,PDF,institutional procedures,2026-04-22,Montenegro deep dossier,data/Montenegro/raw documentation/source notes/Montenegro deep-dive sources.md,"Main statute source for the Mediterranean University route."
ME-S027,Montenegro,CInMED clinical investigation page,https://cinmed.me/en/medical-devices/clinical-investigation/,Website,ethics and boundary regimes,2026-04-22,Montenegro deep dossier,data/Montenegro/raw documentation/source notes/Montenegro deep-dive sources.md,"Specialist route for medical-device clinical investigations and ethics review."
ME-S028,Montenegro,Law on Medicinal Products,https://cinmed.me/wp-content/uploads/2026/03/Law-on-medicinal-products_-2026-final.pdf,PDF,ethics and boundary regimes,2026-04-22,Montenegro deep dossier,data/Montenegro/raw documentation/source notes/Montenegro deep-dive sources.md,"Boundary source for clinical-trial scientific and ethical review."
ME-S029,Montenegro,Agency for Personal Data Protection and Free Access to Information,https://www.azlp.me/en/about-agency,Website,ethics and boundary regimes,2026-04-22,Montenegro deep dossier,data/Montenegro/raw documentation/source notes/Montenegro deep-dive sources.md,"Boundary authority for personal-data and access-to-information issues."
ME-S030,Montenegro,Animal Welfare Law,https://www.gov.me/en/article/90334--160022,Website,ethics and boundary regimes,2026-04-22,Montenegro deep dossier,data/Montenegro/raw documentation/source notes/Montenegro deep-dive sources.md,"Boundary source for animal experiments and welfare."
RO-S001,Romania,Law 183/2024,https://legislatie.just.ro/Public/DetaliiDocument/283972,Website,law references,2026-04-22,Romania deep dossier,data/Romania/raw documentation/source notes/Romania deep-dive sources.md,"Core constitutive law for the CDI integrity lane."
RO-S002,Romania,Order 21343/2024 approving the CNECSDTI regulation,https://legislatie.just.ro/Public/DetaliiDocumentAfis/287937,Website,research integrity offices and bodies,2026-04-22,Romania deep dossier,data/Romania/raw documentation/source notes/Romania deep-dive sources.md,"Official order approving the current organization and procedure of CNECSDTI."
RO-S003,Romania,CNECSDTI regulation,https://legislatie.just.ro/public/DetaliiDocument/287938,Website,misconduct procedures,2026-04-22,Romania deep dossier,data/Romania/raw documentation/source notes/Romania deep-dive sources.md,"Main current regulation for the national CDI ethics council."
RO-S004,Romania,Final selection results for 23 CNECSDTI members,https://www.research.gov.ro/rezultatele-finale-privind-selectia-a-23-membri-pentru-consiliul-national-de-etica-a-cercetarii-stiintifice-dezvoltarii-tehnologice-si-inovarii-si-a-27-membri-pentru-consiliul-national-al-cercetarii-21891/,Website,research integrity offices and bodies,2026-04-22,Romania deep dossier,data/Romania/raw documentation/source notes/Romania deep-dive sources.md,"Best public current-composition trace for the renewed national CDI council."
RO-S005,Romania,CNECSDTI decision clarifications page,https://www.research.gov.ro/precizari-cu-privire-la-deciziile-consiliului-national-de-etica-cercetarii-stiintifice-dezvoltarii-tehnologice-si-inovarii-cnecsdti-11349/,Website,reports and monitoring,2026-04-22,Romania deep dossier,data/Romania/raw documentation/source notes/Romania deep-dive sources.md,"Used to confirm public-facing decision and clarification practice at national level."
RO-S006,Romania,Order 6886/2025 approving the CDI ethics code,https://legislatie.just.ro/Public/DetaliiDocumentAfis/305717,Website,codes of conduct,2026-04-22,Romania deep dossier,data/Romania/raw documentation/source notes/Romania deep-dive sources.md,"Official approval page for the general CDI ethics code."
RO-S007,Romania,Order 6905/2025 approving the four domain-specific CDI codes,https://legislatie.just.ro/Public/DetaliiDocumentAfis/305731,Website,codes of conduct,2026-04-22,Romania deep dossier,data/Romania/raw documentation/source notes/Romania deep-dive sources.md,"Official approval page for the field-specific CDI ethics codes."
RO-S008,Romania,ANC organization page,https://www.research.gov.ro/autoritate/organizare/,Website,national policies and guidance,2026-04-22,Romania deep dossier,data/Romania/raw documentation/source notes/Romania deep-dive sources.md,"Maps the research-governance framework around the integrity system."
RO-S009,Romania,ANC legislation page,https://www.research.gov.ro/autoritate/legislatie/,Website,national policies and guidance,2026-04-22,Romania deep dossier,data/Romania/raw documentation/source notes/Romania deep-dive sources.md,"Used to place the integrity layer inside the wider national research-law framework."
RO-S010,Romania,Research-organization performance evaluation page,https://www.research.gov.ro/sistemul-de-cercetare/evaluarea-performantei-organizatiilor-de-cercetare/,Website,reports and monitoring,2026-04-22,Romania deep dossier,data/Romania/raw documentation/source notes/Romania deep-dive sources.md,"Used to show the evaluation infrastructure surrounding the CDI system."
RO-S011,Romania,UEFISCDI consultative councils page,https://uefiscdi.gov.ro/consilii-consultative-cdi,Website,research integrity offices and bodies,2026-04-22,Romania deep dossier,data/Romania/raw documentation/source notes/Romania deep-dive sources.md,"Best public route to CNCS, CCCDI and CNECSDTI as consultative bodies."
RO-S012,Romania,Law 199/2023,https://legislatie.just.ro/public/DetaliiDocument/271898,Website,law references,2026-04-22,Romania deep dossier,data/Romania/raw documentation/source notes/Romania deep-dive sources.md,"Core higher-education law for university ethics commissions and appeals."
RO-S013,Romania,HG 305/2024 approving the framework university ethics code,https://legislatie.just.ro/Public/DetaliiDocumentAfis/281569,Website,law references,2026-04-22,Romania deep dossier,data/Romania/raw documentation/source notes/Romania deep-dive sources.md,"Official government-decision page for the framework code of university ethics and deontology."
RO-S014,Romania,Framework university ethics code text,https://legislatie.just.ro/Public/DetaliiDocumentAfis/281570,Website,codes of conduct,2026-04-22,Romania deep dossier,data/Romania/raw documentation/source notes/Romania deep-dive sources.md,"Official text of the framework university ethics code."
RO-S015,Romania,Order 6869/2024 on university ethics commissions,https://legislatie.just.ro/Public/DetaliiDocumentAfis/289094,Website,misconduct procedures,2026-04-22,Romania deep dossier,data/Romania/raw documentation/source notes/Romania deep-dive sources.md,"Framework regulation for the organization and functioning of university ethics commissions."
RO-S016,Romania,CNATDCU page,https://www.edu.ro/CNATDCU,Website,research integrity offices and bodies,2026-04-22,Romania deep dossier,data/Romania/raw documentation/source notes/Romania deep-dive sources.md,"Main public route for doctorate- and title-related national appeals."
RO-S017,Romania,CEMU legislation page,https://www.cemu.ro/index.php/legislatie/,Website,research integrity offices and bodies,2026-04-22,Romania deep dossier,data/Romania/raw documentation/source notes/Romania deep-dive sources.md,"Public legal and composition route for CNEMU or CEMU."
RO-S018,Romania,CEMU organization page,https://www.cemu.ro/index.php/organizare/,Website,research integrity offices and bodies,2026-04-22,Romania deep dossier,data/Romania/raw documentation/source notes/Romania deep-dive sources.md,"Used to map the current committee structure and contact route."
RO-S019,Romania,CEMU audit procedure,https://www.cemu.ro/wp-content/uploads/2021/01/Procedura-CEMU-privind-auditarea_final.pdf,PDF,reports and monitoring,2026-04-22,Romania deep dossier,data/Romania/raw documentation/source notes/Romania deep-dive sources.md,"Shows the audit role over university ethics commissions."
RO-S020,Romania,University of Bucharest ethics commission page,https://unibuc.ro/despre-ub/organizare/comisii/comisia-de-etica/,Website,institutional procedures,2026-04-22,Romania deep dossier,data/Romania/raw documentation/source notes/Romania deep-dive sources.md,"Main institutional route page for the University of Bucharest ethics commission."
RO-S021,Romania,University of Bucharest cases page,https://unibuc.ro/despre-ub/organizare/comisii/comisia-de-etica/cazurile-comisiei-de-etica/,Website,reports and monitoring,2026-04-22,Romania deep dossier,data/Romania/raw documentation/source notes/Romania deep-dive sources.md,"Strong public case-publication source in the university sector."
RO-S022,Romania,University of Bucharest research ethics page,https://unibuc.ro/cercetare/etica-in-cercetare/,Website,ethics and boundary regimes,2026-04-22,Romania deep dossier,data/Romania/raw documentation/source notes/Romania deep-dive sources.md,"Main route for the university's research-ethics approval layer."
