source_id,country,title,url,source_type,raw_documentation_category,accessed,used_for,stored_in,notes
AL-S001,Albania,ASCAL mission and activity,https://mail.ascal.al/en/about-us/mission-and-activity,Website,research integrity offices and bodies,2026-04-16,Initial source map,data/Albania/raw documentation/source notes/initial extraction notes.md,"Used to identify ASCAL role, legal basis, and higher-education quality-assurance function."
AL-S002,Albania,ASCAL Accreditation Board organization,https://www.ascal.al/en/accreditation-board/organization,Website,research integrity offices and bodies,2026-04-16,Initial source map,data/Albania/raw documentation/source notes/initial extraction notes.md,"Used to identify the accreditation board and quality-assurance decision structure."
AL-S003,Albania,University of Tirana legislation page,https://unitir.edu.al/legjislacioni/,Website,law references,2026-04-16,Initial source map,data/Albania/raw documentation/source notes/initial extraction notes.md,"Used to identify Law No. 80/2015, university statute, regulations, and ethics code as candidate sources."
AL-S004,Albania,University of Tirana Code of Ethics,https://unitir.edu.al/kodi-i-etikes-i-universitetit-te-tiranes/,Website,codes of conduct,2026-04-16,Initial source map,data/Albania/raw documentation/source notes/initial extraction notes.md,"Used as first institutional ethics-code source."
AL-S005,Albania,University of Tirana regulations page,https://unitir.edu.al/uni-3/,Website,institutional procedures,2026-04-16,Initial source map,data/Albania/raw documentation/source notes/initial extraction notes.md,"Used to identify institutional regulations, ethics code, and whistleblowing-related material."
"AL-S006","Albania","Law No. 80/2015 on higher education and scientific research","https://qsha.gov.al/wp-content/uploads/2024/01/LAW-No-80.2015-ON-HIGHER-EDUCATION-AND-SCIENTIFIC-RESEARCH-IN-INSTITUTIONS-OF-HIGHER-EDUCATION-IN-THE-REPUBLIC-OF-ALBANIA.pdf","PDF","law references / higher education and scientific research law","2026-04-26","Albania expanded overview and committee-route pass","data/Albania/raw documentation/source notes/initial extraction notes.md","Official English PDF copy used for the HEI research frame, institutional ethics councils, research activity and QA scaffold."
"AL-S007","Albania","NASRI research and publishing ethics regulation","https://nasri.gov.al/dokumenta/RregullorjaKerkimit.pdf","PDF","codes of conduct / research and publishing ethics procedure","2026-04-26","Albania expanded overview and committee-route pass","data/Albania/raw documentation/source notes/initial extraction notes.md","NASRI-hosted regulation on research and publishing ethics; used for complaint-management, ethics-committee, plagiarism, data, authorship, review and conflict-of-interest provisions."
"AL-S008","Albania","NASRI national R&D programmes page","https://nasri.gov.al/programet-kombetare-te-kerkimit-dhe-zhvillimit/","Website","funder requirements / national R&D programme route","2026-04-26","Albania expanded overview and committee-route pass","data/Albania/raw documentation/source notes/initial extraction notes.md","Official AKKSHI/NASRI page for national R&D programme application, evaluation, implementation, reporting and monitoring routes."
"AL-S009","Albania","NASRI AKKSHI legal-basis file","https://nasri.gov.al/wp-content/uploads/2019/04/Tabela-e-AKKSHI-baza-ligjore-15.04.2019.pdf","PDF","national policies and guidance / science agency legal basis","2026-04-26","Albania expanded overview and committee-route pass","data/Albania/raw documentation/source notes/initial extraction notes.md","Legal-basis compilation used for AKKSHI creation, mission, funding, monitoring, evaluation and public-database duties."
"AL-S010","Albania","ASCAL Accreditation Board decisions","https://www.ascal.al/en/accreditation-board/decisions","Website","reports and monitoring / QA decision hub","2026-04-26","Albania expanded overview and committee-route pass","data/Albania/raw documentation/source notes/initial extraction notes.md","Official public Accreditation Board decision corridor; coded as quality-assurance decision material, not a general research-misconduct archive."
"AL-S011","Albania","University of Tirana Ethics Council regulation page","https://unitir.edu.al/rregullore-per-organizimin-dhe-funksionimin-e-keshillit-te-etikes-ne-universitetin-e-tiranes/","Website","institutional procedures / ethics council route","2026-04-26","Albania expanded overview and committee-route pass","data/Albania/raw documentation/source notes/initial extraction notes.md","Official UT page for Senate decision No. 16 of 19 March 2025 approving the Ethics Council regulation and linking the research-ethics approval guide."
"AL-S012","Albania","University of Tirana research page","https://unitir.edu.al/kerkimi-shkencor/","Website","institutional procedures / research project administration","2026-04-26","Albania expanded overview and committee-route pass","data/Albania/raw documentation/source notes/initial extraction notes.md","Official UT research page with project administration, research plan, accreditation and strategic-development links; used as institutional research-governance route evidence."
"AL-S013","Albania","UAMD Ethics Council and permanent committees page","https://uamd.edu.al/keshilli-i-etikes-dhe-komisionet-e-perhershme-institucionale-uamd/","Website","institutional procedures / committee directory","2026-04-26","Albania expanded overview and committee-route pass","data/Albania/raw documentation/source notes/initial extraction notes.md","Official UAMD page identifying the Ethics Council and Institutional Academic Integrity Commission; committee visibility without public decisions located."
"AL-S014","Albania","UAMD information and documents page","https://uamd.edu.al/informacione-dhe-dokumenta2/","Website","institutional procedures / research ethics documents","2026-04-26","Albania expanded overview and committee-route pass","data/Albania/raw documentation/source notes/initial extraction notes.md","Official UAMD document hub linking the university ethics code, research-activity management regulation and research-ethics code."
"AL-S015","Albania","University of Elbasan Ethics Council","https://uniel.edu.al/universiteti-ue/keshilli-i-etikes","Website","institutional procedures / ethics council page","2026-04-26","Albania expanded overview and committee-route pass","data/Albania/raw documentation/source notes/initial extraction notes.md","Official page for the Ethics Council created by Senate decision No. 07 of 7 February 2020; teaching and research ethics scope, membership and ethics-code link."
"AL-S016","Albania","University of Medicine Tirana governing bodies page","https://umed.edu.al/universiteti/organet-drejtuese/?lang=en","Website","institutional procedures / ethics council route","2026-04-26","Albania expanded overview and committee-route pass","data/Albania/raw documentation/source notes/initial extraction notes.md","Official UMT page identifying the Ethics Council as a collegiate body for teaching, research and institutional ethics."
"AL-S017","Albania","University of Medicine Tirana Annual Report 2023-2024","https://umed.edu.al/wp-content/uploads/2026/02/Raporti-Vjetor-UMT-2023-2024-_Final-mars-2025docx.pdf","PDF","reports and monitoring / institutional annual-report case trace","2026-04-26","Albania expanded overview and committee-route pass","data/Albania/raw documentation/source notes/initial extraction notes.md","Official UMT annual report; records about 150 ethics requests and 45 ethics decisions in 2024, aggregate only."
"AL-S018","Albania","AKBPM mission page","https://akbpm.gov.al/akbpm/misioni/","Website","ethics and boundary regimes / medicines authority route","2026-04-26","Albania expanded overview and committee-route pass","data/Albania/raw documentation/source notes/initial extraction notes.md","Official medicines and medical-devices agency page used for the clinical and medicines boundary route."
"AL-S019","Albania","AKBPM updated medicines law PDF","https://akbpm.gov.al/wp-content/uploads/2023/12/ligj-2014-07-31-105_perditesuar-13.pdf","PDF","ethics and boundary regimes / clinical-trial law","2026-04-26","Albania expanded overview and committee-route pass","data/Albania/raw documentation/source notes/initial extraction notes.md","Updated Law No. 105/2014 source used for clinical-trial and ethics-committee boundary mapping."
"AL-S020","Albania","Information and Data Protection Commissioner decisions page","https://idp.al/en/decisions/","Website","ethics and boundary regimes / data-protection decision page","2026-04-26","Albania expanded overview and committee-route pass","data/Albania/raw documentation/source notes/initial extraction notes.md","Official data-protection decision page; boundary publication source, not research-misconduct case publication."
"AL-S021","Albania","General Directorate of Industrial Property home and register page","https://dppi.gov.al/en/","Website","ethics and boundary regimes / IP register and appeal infrastructure","2026-04-26","Albania expanded overview and committee-route pass","data/Albania/raw documentation/source notes/initial extraction notes.md","Official industrial-property office page exposing registers, appeal/chamber infrastructure and publications; IP boundary route."
"AL-S022","Albania","ASCAL mission and activity","https://mail.ascal.al/en/about-us/mission-and-activity","Website","research integrity offices and bodies / quality-assurance actor","2026-04-26","Albania expanded overview and committee-route pass","data/Albania/raw documentation/source notes/initial extraction notes.md","Updated use of existing ASCAL source for QA classification and legal basis under DCM No. 109 and Law No. 80/2015."
"AL-S023","Albania","ASCAL Accreditation Board organization","https://www.ascal.al/en/accreditation-board/organization","Website","research integrity offices and bodies / quality-assurance decision body","2026-04-26","Albania expanded overview and committee-route pass","data/Albania/raw documentation/source notes/initial extraction notes.md","Updated use of existing Accreditation Board source for final QA decision-maker role, current appointment and distinction from misconduct handling."
AD-S001,Andorra,AQUA profile,https://www.aqua.ad/en/node/33,Website,research integrity offices and bodies,2026-04-16,Initial source map,data/Andorra/raw documentation/source notes/initial extraction notes.md,"Used to identify AQUA as higher-education quality-assurance actor."
AD-S002,Andorra,AQUA Law 9/2016 PDF,https://www.aqua.ad/sites/default/files/2024-01/37_17-003_llei_9-2016_28_juny_agencia_qualitat_ensenyament_superior.pdf,PDF,law references,2026-04-16,Initial source map,data/Andorra/raw documentation/source notes/initial extraction notes.md,"Agency-law source for AQUA."
AD-S003,Andorra,Consolidated higher-education law PDF,https://www.aqua.ad/sites/default/files/2024-01/36_17-002_decret_legislatiu_30_05_18_text_refos_llei_12_2008_ensenyament_superior.pdf,PDF,law references,2026-04-16,Initial source map,data/Andorra/raw documentation/source notes/initial extraction notes.md,"Legal source for Andorran higher education."
AD-S004,Andorra,AQUA Code of Ethics PDF,https://www.aqua.ad/sites/default/files/2024-01/3_17-004_aqua_code_ethics_en.pdf,PDF,codes of conduct,2026-04-16,Initial source map,data/Andorra/raw documentation/source notes/initial extraction notes.md,"Agency/evaluator ethics source."
AD-S005,Andorra,AQUA Strategic Plan 2026-2028 PDF,https://www.aqua.ad/sites/default/files/2024-10/Strategic%20Plan%202026-2028_1.pdf,PDF,reports and monitoring,2026-04-16,Initial source map,data/Andorra/raw documentation/source notes/initial extraction notes.md,"Current mandate and priority source for quality assurance."
AD-S006,Andorra,University of Andorra CoARA national chapters meeting,https://www.uda.ad/blog/andorra-hosts-the-second-meeting-of-the-coara-national-chapters/,Website,open science and data,2026-04-16,Initial source map,data/Andorra/raw documentation/source notes/initial extraction notes.md,"Research-assessment reform signal, not a misconduct source."
"AD-S007","Andorra","AQUA agency page","https://www.aqua.ad/lagencia","Website","research integrity offices and bodies / quality-assurance actor","2026-04-26","Andorra expanded overview and committee-route pass","data/Andorra/raw documentation/source notes/initial extraction notes.md","Official AQUA page used for mandate, functions and classification as higher-education and research-quality assurance actor."
"AD-S008","Andorra","AQUA evaluations and institutional legal frame","https://www.aqua.ad/avaluacions-0","Website","reports and monitoring / quality-assurance route","2026-04-26","Andorra expanded overview and committee-route pass","data/Andorra/raw documentation/source notes/initial extraction notes.md","Official AQUA evaluation page used for institutional evaluation process, law links, appeals signal and distinction from misconduct handling."
"AD-S009","Andorra","AQUA 2024 activity report","https://www.aqua.ad/sites/default/files/2025-06/2_24-041_Mem%C3%B2ria_activitats_2024.pdf","PDF","reports and monitoring / quality-assurance annual report","2026-04-26","Andorra expanded overview and committee-route pass","data/Andorra/raw documentation/source notes/initial extraction notes.md","Annual-report source for AQUA programme-evaluation tables, favourable/unfavourable/pending outcomes and the academic-integrity research line."
"AD-S010","Andorra","AQUA appeals page","https://www.aqua.ad/avaluacions-4","Website","reports and monitoring / quality-assurance appeal route","2026-04-26","Andorra expanded overview and committee-route pass","data/Andorra/raw documentation/source notes/initial extraction notes.md","Official route for administrative appeals against AQUA evaluation resolutions; procedure found but no public appeal-decision archive located."
"AD-S011","Andorra","AQUA appeal guide","https://www.aqua.ad/sites/default/files/2025-04/Guia%20d%27apel%C2%B7laci%C3%B3_mar%C3%A7%202025_V1%201.pdf","PDF","institutional procedures / quality-assurance appeal guide","2026-04-26","Andorra expanded overview and committee-route pass","data/Andorra/raw documentation/source notes/initial extraction notes.md","March 2025 guide used for Commission of Appeals composition, appeal steps, recusal route and motivated-resolution process."
"AD-S012","Andorra","AQUA organs-management guide","https://www.aqua.ad/sites/default/files/2025-04/Guia%20gesti%C3%B3%20%C3%B2rgans%20AQUA%20v1.pdf","PDF","institutional procedures / quality-assurance governance","2026-04-26","Andorra expanded overview and committee-route pass","data/Andorra/raw documentation/source notes/initial extraction notes.md","Used for AQUA committee governance, code-of-ethics commitments and expert/commission obligations."
"AD-S013","Andorra","University of Andorra Research and Doctoral Commission","https://www.uda.ad/recerca/escola-internacional-de-doctorat/comissio-de-recerca-i-doctorat/","Website","institutional procedures / research-governance route","2026-04-26","Andorra expanded overview and committee-route pass","data/Andorra/raw documentation/source notes/initial extraction notes.md","Official UdA page used for research-policy, research-line, project, group, coordination and doctoral-monitoring functions."
"AD-S014","Andorra","University of Andorra doctoral programme","https://www.uda.ad/programa-de-doctorat/","Website","institutional procedures / doctoral governance","2026-04-26","Andorra expanded overview and committee-route pass","data/Andorra/raw documentation/source notes/initial extraction notes.md","Used for doctoral milestones, supervisor accreditation, external evaluation and Research and Doctoral Commission role."
"AD-S015","Andorra","University of Andorra guides and procedures page","https://www.uda.ad/universitat/consell-de-la-qualitat/guies-i-procediments/","Website","institutional procedures / quality council academic-integrity route","2026-04-26","Andorra expanded overview and committee-route pass","data/Andorra/raw documentation/source notes/initial extraction notes.md","Official Quality Council page linking the procedure for avoiding and managing plagiarism and academic fraud."
"AD-S016","Andorra","University of Andorra plagiarism and academic-fraud procedure","https://www.uda.ad/wp-content/uploads/2024/05/PlagiFrauAcademic042024.pdf","PDF","misconduct procedures / academic-integrity procedure","2026-04-26","Andorra expanded overview and committee-route pass","data/Andorra/raw documentation/source notes/initial extraction notes.md","April 2024 procedure used for plagiarism and fraud management in evaluable activities; coded as academic-integrity/teaching route rather than public research-misconduct archive."
"AD-S017","Andorra","University of Andorra research-groups regulation","https://www.uda.ad/wp-content/uploads/2024/06/Reglament-grups-de-recerca.pdf","PDF","institutional procedures / research groups","2026-04-26","Andorra expanded overview and committee-route pass","data/Andorra/raw documentation/source notes/initial extraction notes.md","Official UdA regulation used for research-group route and confidentiality/governance signals."
"AD-S018","Andorra","Government third-cycle grants page","https://www.govern.ad/ca/ministeris-i-secretaries-d-estat/ministeri-de-relacions-institucionals-educacio-i-universitats/departament-d-ensenyament-superior-recerca-i-innovacio-tecnologica/recerca/ajuts-a-la-recerca/ajuts-de-3r-cicle","Website","funder requirements / doctoral grants","2026-04-26","Andorra expanded overview and committee-route pass","data/Andorra/raw documentation/source notes/initial extraction notes.md","Official Department of Higher Education, Research and Technological Innovation page for third-cycle grants and BOPA-linked calls."
"AD-S019","Andorra","Government research dissemination page","https://www.govern.ad/ca/ministeris-i-secretaries-d-estat/ministeri-de-relacions-institucionals-educacio-i-universitats/departament-d-ensenyament-superior-recerca-i-innovacio-tecnologica/recerca/difusio","Website","reports and monitoring / research ecosystem","2026-04-26","Andorra expanded overview and committee-route pass","data/Andorra/raw documentation/source notes/initial extraction notes.md","Government research-dissemination page used for current research-support and investigator-community context."
"AD-S020","Andorra","Andorra Recerca + Innovacio who-we-are page","https://www.ari.ad/qui-som","Website","research integrity offices and bodies / public research actor","2026-04-26","Andorra expanded overview and committee-route pass","data/Andorra/raw documentation/source notes/initial extraction notes.md","Official AR+I page used to identify the public-sector research and innovation foundation, Law 11/2021 link and mission; not an adjudication route."
"AD-S021","Andorra","Ministry of Health CEI page","https://www.govern.ad/ca/tematiques/salut/temes-de-salut/recerca-en-l-ambit-de-la-salut-i-la-biomedicina/comissio-d-etica-de-la-investigacio-cei","Website","ethics and boundary regimes / biomedical ethics committee","2026-04-26","Andorra expanded overview and committee-route pass","data/Andorra/raw documentation/source notes/initial extraction notes.md","Official page for the Comissio d'Etica de la Investigacio; used for clinical and biomedical research approval route."
"AD-S022","Andorra","Law 3/2023 on biomedical research and innovation","https://portaljuridicandorra.ad/L2023003","Website","law references / biomedical research law","2026-04-26","Andorra expanded overview and committee-route pass","data/Andorra/raw documentation/source notes/initial extraction notes.md","Legal Portal text used for CEI functions, centre ethics committee route and ministry authorization under the biomedical research boundary."
"AD-S023","Andorra","APDA resolutions page","https://www.apda.ad/resolucions","Website","ethics and boundary regimes / data-protection decision page","2026-04-26","Andorra expanded overview and committee-route pass","data/Andorra/raw documentation/source notes/initial extraction notes.md","Official data-protection resolution and instruction page; coded as boundary decision source, not general research-misconduct publication."
"AD-S024","Andorra","OMPA trademarks and patents page","https://www.govern.ad/ca/tematiques/empresa-i-emprenedoria/ompa","Website","ethics and boundary regimes / IP register and route","2026-04-26","Andorra expanded overview and committee-route pass","data/Andorra/raw documentation/source notes/initial extraction notes.md","Official trademarks and patents route for IP boundary mapping, including registers, gazettes and forms."
AM-S001,Armenia,HESC laws and regulations page,https://degrees.hesc.am/en/node/542,Website,law references,2026-04-16,Initial source map,data/Armenia/raw documentation/source notes/initial extraction notes.md,"Used to identify laws and regulations on scientific activity and degree award."
AM-S002,Armenia,HESC about page,https://degrees.hesc.am/en/about-us,Website,research integrity offices and bodies,2026-04-16,Initial source map,data/Armenia/raw documentation/source notes/initial extraction notes.md,"Used to identify committee functions and degree-award responsibilities."
AM-S003,Armenia,HESC defense-process page,https://degrees.hesc.am/en/node/540,Website,institutional procedures,2026-04-16,Initial source map,data/Armenia/raw documentation/source notes/initial extraction notes.md,"Used to identify document-integrity check in the defense process."
AM-S004,Armenia,Council of Europe page on Armenian RECs,https://www.coe.int/en/web/yerevan/news1/-/asset_publisher/wWTBvPqHlz8x/content/members-of-armenian-research-ethics-committees-have-strengthened-their-capacities-in-line-with-the-main-principles-and-standards-of-european-recs,Website,ethics and boundary regimes,2026-04-16,Initial source map,data/Armenia/raw documentation/source notes/initial extraction notes.md,"Used to identify Armenian biomedical research ethics committees and European standards link."
"AM-S005","Armenia","HESC orders page","https://degrees.hesc.am/en/orders","Website","reports and monitoring / degree-title order stream","2026-04-28","Armenia first expanded app dossier","data/Armenia/raw documentation/source notes/initial extraction notes.md","Public HESC/Supreme Certifying Committee order stream for scientific degrees and academic titles; extraction target for later award refusal revocation and appeal classification."
"AM-S006","Armenia","HESC specialized academic councils directory","https://degrees.hesc.am/en/councils","Website","institutional procedures / degree-award councils","2026-04-28","Armenia first expanded app dossier","data/Armenia/raw documentation/source notes/initial extraction notes.md","Used to map the specialized academic council network behind dissertation-defense and degree-award handling."
"AM-S007","Armenia","HESC doctoral dissertation guide","https://degrees.hesc.am/en/node/568","Website","institutional procedures / dissertation standards","2026-04-28","Armenia first expanded app dossier","data/Armenia/raw documentation/source notes/initial extraction notes.md","Used for dissertation-publication and citation/reuse standards in the degree-award route."
"AM-S008","Armenia","HESC Incoming Research Fellowship Program 2025/2 call","https://irf-armenia-2025.hesc.am/documents/25IRF-2_Call_ENG.pdf","PDF","funder requirements / grant compliance","2026-04-28","Armenia first expanded app dossier","data/Armenia/raw documentation/source notes/initial extraction notes.md","Official HESC call used for predatory or fraudulent publication checks output requirements reporting funding termination and future-application consequence rules."
"AM-S009","Armenia","ANQA accreditation page","https://www.anqa.am/en/accreditation/","Website","reports and monitoring / QA decision and expert-report corridor","2026-04-28","Armenia first expanded app dossier","data/Armenia/raw documentation/source notes/initial extraction notes.md","Official ANQA page for accreditation process Accreditation Committee decisions expert reports and quality-assurance distinction from misconduct publication."
"AM-S010","Armenia","ANQA State Accreditation Register","https://register.anqa.am/","Website","reports and monitoring / QA register","2026-04-28","Armenia first expanded app dossier","data/Armenia/raw documentation/source notes/initial extraction notes.md","Official register landing page for institutional and programme accreditation; coded as QA register not misconduct archive."
"AM-S011","Armenia","National Institute of Health Ethics Committee","https://new.nih.am/subdivisions/ethics_committee/","Website","ethics and boundary regimes / biomedical REC route","2026-04-28","Armenia first expanded app dossier","data/Armenia/raw documentation/source notes/initial extraction notes.md","Official NIH Ethics Committee page used for biomedical and behavioral research review route and 5 June 2021 establishment signal."
"AM-S012","Armenia","Yerevan State Medical University Ethics Committee","https://ysmu.am/en/research/ethics-committee/","Website","institutional procedures / medical university ethics committee","2026-04-28","Armenia first expanded app dossier","data/Armenia/raw documentation/source notes/initial extraction notes.md","Official YSMU route source for clinical medical pharmacological animal research and behavioral ethics review with positive positive-with-remarks and negative conclusions."
