source_id,country,title,url,source_type,raw_documentation_category,accessed,used_for,stored_in,notes
SK-S028,Slovakia,UPJS minutes 23 March 2026,https://www.upjs.sk/app/uploads/2026/04/Zapis-EK-23.03.2026.pdf,PDF,transparency and case publication,2026-04-23,Slovakia committee and case-file pilot,data/Slovakia/raw documentation/source notes/Slovakia deep-dive sources.md,"Representative institutional minutes and statement file showing a Slovak micro-publication node."
SK-S029,Slovakia,STU ethics committee opinions,https://www.stuba.sk/sk/stu/akademicke-a-samospravne-organy/eticka-komisia-stu/stanoviska-ek-stu.html?month=1&page_id=14371&year=2025,Website,transparency and case publication,2026-04-23,Slovakia committee and case-file pilot,data/Slovakia/raw documentation/source notes/Slovakia deep-dive sources.md,"Opinion list proving that STU publishes complaint outputs."
SK-S030,Slovakia,STU opinion on complaint 2/2024,https://www.stuba.sk/buxus/docs/stu/pracoviska/rektorat/odd_veda_vyskum/Eticka_komisia_/Stanovisko_EKSTU_2_2024_2025-9-17.pdf,PDF,transparency and case publication,2026-04-23,Slovakia committee and case-file pilot,data/Slovakia/raw documentation/source notes/Slovakia deep-dive sources.md,"Representative complaint opinion showing scope boundaries and a finding on publication-ethics-related claims."
MD-S001,Moldova,ANACEC Governing Board decisions,https://anacec.md/en/content/governing-board,Website,transparency and case publication,2026-04-23,Moldova committee and case-file pilot,data/Moldova/raw documentation/source notes/Moldova deep-dive sources.md,"Stable dated decision hub mixing doctoral, title-confirmation, appeal and quality-assurance outputs; strongest national publication lane found for Moldova."
MD-S002,Moldova,ANACEC note rejecting confirmation of doctorate in law,https://anacec.md/files/D10_07.07.2023_Nota.PDF,PDF,transparency and case publication,2026-04-23,Moldova committee and case-file pilot,data/Moldova/raw documentation/source notes/Moldova deep-dive sources.md,"Representative named ANACEC case note showing thesis-specific reasoning and publication-integrity objections in a title-confirmation refusal."
MD-S003,Moldova,ANACEC annex rejecting economics doctorate decision,https://anacec.md/files/1.O.%20Decizii%2016.05.2025/D9_ANEXA_CC_16.05.2025_Invalidare-Dr-SD-economie.pdf,PDF,transparency and case publication,2026-04-23,Moldova committee and case-file pilot,data/Moldova/raw documentation/source notes/Moldova deep-dive sources.md,"Representative named ANACEC annex showing recent title-confirmation refusal practice and expert-review objections."
MD-S004,Moldova,Ethics and Management Council document hub,https://mec.gov.md/ro/content/consiliului-de-etica-si-management-0,Website,research integrity offices and bodies,2026-04-23,Moldova committee and case-file pilot,data/Moldova/raw documentation/source notes/Moldova deep-dive sources.md,"Official ministry page for the council regulation, composition orders and archive traces; no public decision archive identified in this pass."
MD-S005,Moldova,2025 education-sector anticorruption implementation report,https://mec.gov.md/sites/default/files/raport_privind_implementarea_in_anul_2025_a_planului_sectorial_anticoruptie_in_domeniul_educatiei_aprobat_prin_ordinul_ministrului_educatiei_si_cercetarii_nr._658_din_07.05.2025._1_2.pdf,PDF,reports and monitoring,2026-04-23,Moldova committee and case-file pilot,data/Moldova/raw documentation/source notes/Moldova deep-dive sources.md,"Aggregate ministry reporting confirming that the Ethics and Management Council examined 3 submissions in 2025; useful for coding activity visibility without a decision archive."
ME-S031,Montenegro,Ethics Charter,https://www.gov.me/clanak/eticka-povelja,Website,codes of conduct,2026-04-23,Montenegro committee and case-file pilot,data/Montenegro/raw documentation/source notes/Montenegro deep-dive sources.md,"Direct national charter source adopted under the Law on Academic Integrity; closes a source gap from the earlier Montenegro draft."
ME-S032,Montenegro,Archived 2020 Ethics Committee decisions,https://www.gov.me/clanak/223606--odluke-etickog-komiteta,Website,transparency and case publication,2026-04-23,Montenegro committee and case-file pilot,data/Montenegro/raw documentation/source notes/Montenegro deep-dive sources.md,"Archived official decisions page showing early public case output and continuity beyond the current committee page."
ME-S033,Montenegro,VI session of the Ethics Committee,https://www.gov.me/clanak/vi-sjednica-etickog-komiteta,Website,transparency and case publication,2026-04-23,Montenegro committee and case-file pilot,data/Montenegro/raw documentation/source notes/Montenegro deep-dive sources.md,"Representative national session page reporting a finding of autoplagiarism and linking decision material."
ME-S034,Montenegro,XIII session of the Ethics Committee,https://www.gov.me/clanak/xiii-sjednica-etickog-komiteta,Website,transparency and case publication,2026-04-23,Montenegro committee and case-file pilot,data/Montenegro/raw documentation/source notes/Montenegro deep-dive sources.md,"Current session page showing complaint lifecycle, rejection reasoning and institutional-boundary signals."
ME-S035,Montenegro,University of Montenegro Ethics Board page,https://www.ucg.ac.me/objava/blog/3/objava/50-eticki-odbor,Website,institutional procedures,2026-04-23,Montenegro committee and case-file pilot,data/Montenegro/raw documentation/source notes/Montenegro deep-dive sources.md,"Official institutional committee page showing the local ethics-board route and composition."
ME-S036,Montenegro,Mediterranean University Ethics Code,https://unimediteran.net/wp-content/uploads/2022/11/ETICKI_KODEKS_UM_nov2022.pdf,PDF,institutional procedures,2026-04-23,Montenegro committee and case-file pilot,data/Montenegro/raw documentation/source notes/Montenegro deep-dive sources.md,"Private-university ethics code showing public statements, Bulletin publication and media publication as local sanction-publicity routes."
ME-S037,Montenegro,University of Donja Gorica Ethics Code,https://integritet.udg.edu.me/storage/documents/etickikodeksudg21670496457-1678796241.pdf,PDF,institutional procedures,2026-04-23,Montenegro committee and case-file pilot,data/Montenegro/raw documentation/source notes/Montenegro deep-dive sources.md,"Institutional ethics code requiring annual reports, records of imposed measures and public website publication at UDG."
PL-S034,Poland,PAN 2023 activity report,https://journals.pan.pl/Content/131963/PDF/N%23224-11-G%C3%B3rski.pdf,PDF,transparency and case publication,2026-04-23,Poland committee and case-file pilot,data/Poland/raw documentation/source notes/Poland deep-dive sources.md,"Aggregate national case-report source showing 17 matters handled in 2023, categories of alleged breaches and anonymized examples."
PL-S035,Poland,PAN plenary meeting 15 April 2024,https://pan.pl/posiedzenie-plenarne-komisji-do-spraw-etyki-w-nauce-15-kwietnia-2024-roku/,Website,transparency and case publication,2026-04-23,Poland committee and case-file pilot,data/Poland/raw documentation/source notes/Poland deep-dive sources.md,"Official plenary note summarizing suspected plagiarism, rector-discipline and clinical-trial related matters; useful as anonymized case-trace evidence."
PL-S036,Poland,PAN plenary meeting 17 June 2024,https://pan.pl/en/posiedzenie-plenarne-komisji-do-spraw-etyki-w-nauce-w-dniu-17-czerwca-2024-roku/,Website,transparency and case publication,2026-04-23,Poland committee and case-file pilot,data/Poland/raw documentation/source notes/Poland deep-dive sources.md,"Official plenary note showing appointed adjudicating panels, adopted opinions and revisited anonymized matters."
PL-S037,Poland,PAN statements and opinions archive,https://pan.pl/baza-wiedzy/stanowiska-i-opinie-komitetow-problemowych-pan/,Website,transparency and case publication,2026-04-23,Poland committee and case-file pilot,data/Poland/raw documentation/source notes/Poland deep-dive sources.md,"Stable public hub for PAN statements and opinions, useful for continuity and publication-lane mapping."
PL-S038,Poland,Ministerial disciplinary commission,https://www.gov.pl/web/nauka/komisja-dyscyplinarna-przy-ministrze-wlasciwym-do-spraw-szkolnictwa-wyzszego-i-nauki,Website,research integrity offices and bodies,2026-04-23,Poland committee and case-file pilot,data/Poland/raw documentation/source notes/Poland deep-dive sources.md,"Current ministry page for the disciplinary commission for 2025-2028; useful for route mapping even though no public decision archive was found."
PL-S039,Poland,Ministerial disciplinary ombuds,https://www.gov.pl/web/nauka/rzecznicy-dyscyplinarni-ministra,Website,research integrity offices and bodies,2026-04-23,Poland committee and case-file pilot,data/Poland/raw documentation/source notes/Poland deep-dive sources.md,"Official page for minister-appointed disciplinary ombuds who conduct explanatory proceedings in specified categories of cases."
PL-S040,Poland,Research-institute second-instance disciplinary commission,https://www.gov.pl/web/nauka/komisja-dyscyplinarna-ii-instancji-ds-pracownikow-naukowych-i-badawczo-technicznych-w-instytutach-badawczych-przy-ministrze-nauki,Website,research integrity offices and bodies,2026-04-23,Poland committee and case-file pilot,data/Poland/raw documentation/source notes/Poland deep-dive sources.md,"Official page for the second-instance disciplinary route for research-institute scientific and technical staff."
PL-S041,Poland,RGNiSW disciplinary commission page,https://rgnisw.nauka.gov.pl/komisja-dyscyplinarna/,Website,research integrity offices and bodies,2026-04-23,Poland committee and case-file pilot,data/Poland/raw documentation/source notes/Poland deep-dive sources.md,"Appeal-route page clarifying jurisdiction and explicitly noting the special procedural status of PAN opinions."
PL-S042,Poland,University of Warsaw disciplinary communication,https://www.uw.edu.pl/komunikat-dotyczacy-orzeczenia-komisji-dyscyplinarnej/,Website,transparency and case publication,2026-04-23,Poland committee and case-file pilot,data/Poland/raw documentation/source notes/Poland deep-dive sources.md,"Representative institutional micro-publication node with a case-specific notice and appeal update."
PL-S043,Poland,Institute of Psychology PAN ethics committee page,https://psych.pan.pl/nauka/komisja-ds-etyki-badan-naukowych-ip-pan/,Website,institutional procedures,2026-04-23,Poland committee and case-file pilot,data/Poland/raw documentation/source notes/Poland deep-dive sources.md,"Representative PAN-institute ethics-committee route with named members, contact details and application form."
GR-S029,Greece,NKUA EHDE term activity report,https://hub.uoa.gr/apologismos-thiteias-tis-epitropis-ithikis-kai-deontologias-tis-erevnas-tou-panepistimiou-athinon/,Website,transparency and case publication,2026-04-23,Greece committee and case-file pilot,data/Greece/raw documentation/source notes/Greece deep-dive sources.md,"Aggregate institutional activity-report source showing 71 meetings and 213 decisions for 2018 to 23 January 2025; no individual case files."
GR-S030,Greece,University of Macedonia EHDE page,https://www.uom.gr/ethics,Website,institutional procedures,2026-04-23,Greece committee and case-file pilot,data/Greece/raw documentation/source notes/Greece deep-dive sources.md,"Official institutional route confirming research-integrity and ethics remit plus training and guidance role."
GR-S031,Greece,University of Macedonia EHDE triennial report,https://www.uom.gr/11825-epitroph-hthikhs-kai-deontologias-ths-ereynas-apologismos-trietias-2019-2022,Website,transparency and case publication,2026-04-23,Greece committee and case-file pilot,data/Greece/raw documentation/source notes/Greece deep-dive sources.md,"Public 2019-2022 activity-report hub approved at the committee's 20th meeting; aggregate activity trace rather than decision archive."
GR-S032,Greece,University of Thessaly EHDE competences page,https://ehde.uth.gr/%CE%91%CF%81%CE%BC%CE%BF%CE%B4%CE%B9%CF%8C%CF%84%CE%B7%CF%84%CE%B5%CF%82,Website,institutional procedures,2026-04-23,Greece committee and case-file pilot,data/Greece/raw documentation/source notes/Greece deep-dive sources.md,"Procedure source for complaint-triggered review, project monitoring, suspension recommendations and binding decisions."
GR-S033,Greece,Hellenic Mediterranean University EHDE competences page,https://ehde.hmu.gr/armodiotites/,Website,institutional procedures,2026-04-23,Greece committee and case-file pilot,data/Greece/raw documentation/source notes/Greece deep-dive sources.md,"Procedure-only route with fifteen-day complaint decision rule, ten-day request-for-treatment path and explicit clinical-study boundary."
GR-S034,Greece,University of Crete ethics page,https://www.uoc.gr/en/research-en/ethics/,Website,institutional procedures,2026-04-23,Greece committee and case-file pilot,data/Greece/raw documentation/source notes/Greece deep-dive sources.md,"Official page distinguishing UoC REC from the standing University Ethics Committee and breach-investigation role."
GR-S035,Greece,Old EOF National Ethics Committee archive,https://old.eof.gr/web/guest/eed,Website,transparency and case publication,2026-04-23,Greece committee and case-file pilot,data/Greece/raw documentation/source notes/Greece deep-dive sources.md,"Clinical-trial ethics opinion and notice archive with positive-opinion announcements and linked tables; boundary lane not general misconduct."
GR-S036,Greece,EOF April-July 2024 positive-opinion announcement,https://old.eof.gr/web/guest/eed%3Bjsessionid%3D4011bb3f123148a0c454ed9f4102?_62_INSTANCE_x2AD_articleId=9028579&_62_INSTANCE_x2AD_groupId=12225&_62_INSTANCE_x2AD_struts_action=%2Fjournal_articles%2Fview&_62_INSTANCE_x2AD_version=1.0&p_p_col_count=3&p_p_col_id=column-1&p_p_col_pos=2&p_p_id=62_INSTANCE_x2AD&p_p_lifecycle=0&p_p_mode=view&p_p_state=maximized,Website,transparency and case publication,2026-04-23,Greece committee and case-file pilot,data/Greece/raw documentation/source notes/Greece deep-dive sources.md,"Announcement reporting four meetings, 108 initial clinical-trial applications, 300 amendment applications and linked positive-opinion table."
GR-S037,Greece,EOF April-July 2024 positive-opinion table,https://old.eof.gr/c/document_library/get_file?groupId=12225&uuid=d21eb517-6296-43f8-9962-55fbf1392def,PDF,transparency and case publication,2026-04-23,Greece committee and case-file pilot,data/Greece/raw documentation/source notes/Greece deep-dive sources.md,"Representative boundary case-list PDF with EED codes and EU CT or EudraCT identifiers for approved clinical-trial applications and amendments."
GR-S038,Greece,EOF clinical-trials and GCP inspections page,https://www.eof.gr/%CE%BA%CE%BB%CE%B9%CE%BD%CE%B9%CE%BA%CE%AD%CF%82-%CE%B4%CE%BF%CE%BA%CE%B9%CE%BC%CE%AD%CF%82/,Website,ethics and boundary regimes,2026-04-23,Greece committee and case-file pilot,data/Greece/raw documentation/source notes/Greece deep-dive sources.md,"Boundary procedure source for complaint-triggered GCP inspections and initial/final inspection reports shared through regulated parties rather than public archive."
GR-S039,Greece,EOF ACT EU Trial Map announcement,https://www.eof.gr/en/%CE%B5%CE%BD%CE%B5%CF%81%CE%B3%CE%BF%CF%80%CE%BF%CE%B9%CE%B7%CF%83%CE%B7-%CF%87%CE%B1%CF%81%CF%84%CE%B7-%CE%BA%CE%BB%CE%B9%CE%BD%CE%B9%CE%BA%CF%89%CE%BD-%CE%B4%CE%BF%CE%BA%CE%B9%CE%BC%CF%89%CE%BD/,Website,ethics and boundary regimes,2026-04-23,Greece committee and case-file pilot,data/Greece/raw documentation/source notes/Greece deep-dive sources.md,"CTIS public map source showing search by region and medical condition for ongoing clinical trials; boundary registry not misconduct archive."
GR-S040,Greece,EOF Part II assessment-report transition notice,https://www.eof.gr/en/%CE%B1%CE%BD%CF%84%CE%B9%CE%BA%CE%B1%CF%84%CE%AC%CF%83%CF%84%CE%B1%CF%83%CE%B7-%CE%B5%CE%BD%CF%84%CF%8D%CF%80%CE%BF%CF%85-%CE%B3%CE%BD%CF%89%CE%BC%CE%BF%CE%B4%CF%8C%CF%84%CE%B7%CF%83%CE%B7%CF%82/,Website,ethics and boundary regimes,2026-04-23,Greece committee and case-file pilot,data/Greece/raw documentation/source notes/Greece deep-dive sources.md,"Publication-lifecycle source explaining that the official final Part II outcome is now the Part II Assessment Report posted in CTIS."
EE-S022,Estonia,University of Tartu Research Ethics Committee,https://ut.ee/en/node/113848,Website,institutional procedures,2026-04-23,Estonia committee and case-file pilot,data/Estonia/raw documentation/source notes/Estonia deep-dive sources.md,"Current UT institutional ethics route after the 1 January 2026 transition."
EE-S023,Estonia,University of Tartu issued approvals 2025,https://ut.ee/et/media/79762/download?attachment,PDF,transparency and case publication,2026-04-23,Estonia committee and case-file pilot,data/Estonia/raw documentation/source notes/Estonia deep-dive sources.md,"Representative UT approval-list PDF from the 2014-2025 issued-approval archive; ethics approval lane rather than misconduct decisions."
EE-S024,Estonia,TAI Human Research Ethics Committee 2025 decisions,https://www.tai.ee/sites/default/files/2026-01/tai_inimuuringute_eetikakomitee_otsused_2025.docx,DOCX,transparency and case publication,2026-04-23,Estonia committee and case-file pilot,data/Estonia/raw documentation/source notes/Estonia deep-dive sources.md,"Representative TAI decision list with register numbers, project titles, responsible researchers/institutions and TAIEK decision numbers/dates."
EE-S025,Estonia,Estonian Academy of Music and Theatre Research Ethics Committee,https://eamt.ee/teadus/teaduseetika-komisjon/,Website,institutional procedures,2026-04-23,Estonia committee and case-file pilot,data/Estonia/raw documentation/source notes/Estonia deep-dive sources.md,"Institutional committee route created in 2010 with current composition and ETAG referral for high-risk or large-grant studies; no public decision list found."
EE-S026,Estonia,Estonian Literary Museum Ethics Committee statute,https://www.kirmus.ee/sites/default/files/2025-11/EKM%20Eetikakomitee%20statuut.pdf,PDF,institutional procedures,2026-04-23,Estonia committee and case-file pilot,data/Estonia/raw documentation/source notes/Estonia deep-dive sources.md,"Official 2025 statute and composition source for a continuing institutional research-ethics and collection-use committee; no public decision archive found."
EE-S027,Estonia,Estonian Bioethics and Human Research Council ministry page,https://www.sm.ee/eesti-bioeetika-ja-inimuuringute-noukogu,Website,ethics and boundary regimes,2026-04-23,Estonia committee and case-file pilot,data/Estonia/raw documentation/source notes/Estonia deep-dive sources.md,"Official EBIN route, final-meeting/transition source and annual-report/form hub for Human Genes and health-information-system approvals."
EE-S028,Estonia,EBIN annual report 2020,https://www.sm.ee/sites/default/files/documents/2022-06/Eesti%20bioeetika%20ja%20inimuuringute%20n%C3%B5ukogu%20aastaaruanne%202020.pdf,PDF,reports and monitoring,2026-04-23,Estonia committee and case-file pilot,data/Estonia/raw documentation/source notes/Estonia deep-dive sources.md,"Representative EBIN annual-report file with application and decision context for the human-genes and health-data boundary route."
EE-S029,Estonia,Human Genes Research Act,https://www.riigiteataja.ee/en/eli/ee/Riigikogu/act/516032026011/consolide,Website,law references,2026-04-23,Estonia committee and case-file pilot,data/Estonia/raw documentation/source notes/Estonia deep-dive sources.md,"Official legal anchor for the biobank and Human Genes route and the 1 April 2026 transition into the ETAG Research Ethics Committee framework."
EE-S030,Estonia,Estonian Biobank,https://genomics.ut.ee/en/content/estonian-biobank,Website,ethics and boundary regimes,2026-04-23,Estonia committee and case-file pilot,data/Estonia/raw documentation/source notes/Estonia deep-dive sources.md,"Official biobank route requiring EBIN assessment and, for certain biosample work outside Estonia, University of Tartu Senate permission."
EE-S031,Estonia,Data Protection Inspectorate research personal-data page,https://www.aki.ee/isikuandmed/andmetootlejale/isikuandmed-uuringutes,Website,open science and data,2026-04-23,Estonia committee and case-file pilot,data/Estonia/raw documentation/source notes/Estonia deep-dive sources.md,"Official AKI guidance on when research using personal data requires ethics committee or Inspectorate approval."
EE-S032,Estonia,Data Protection Inspectorate annual-report chapter on research data,https://aastaraamat.aki.ee/aastaraamat-2021-2022-tervis/isikuandmed-teadusuuringutes,Website,reports and monitoring,2026-04-23,Estonia committee and case-file pilot,data/Estonia/raw documentation/source notes/Estonia deep-dive sources.md,"Boundary aggregate source noting policy-study application volumes and common transparency problems in research-data applications."
EE-S033,Estonia,Ravimiamet Clinical Trials Regulation,https://www.ravimiamet.ee/en/medicines/clinical-trials/clinical-trials-regulation,Website,ethics and boundary regimes,2026-04-23,Estonia committee and case-file pilot,data/Estonia/raw documentation/source notes/Estonia deep-dive sources.md,"Clinical-trial boundary source linking Estonian procedure to CTIS public database and interactive map."
EE-S034,Estonia,Agriculture and Food Board animal experiments and welfare,https://pta.agri.ee/loomkatsed-ja-katseloomade-heaolu,Website,ethics and boundary regimes,2026-04-23,Estonia committee and case-file pilot,data/Estonia/raw documentation/source notes/Estonia deep-dive sources.md,"Estonian animal-research route with 2026 committee schedule plus EU statistics and non-technical summary database links."
TR-S031,Turkey,TUBITAK UBYT 2026 procedure,https://tubitak.gov.tr/sites/default/files/2026-02/79_YK_islenmis_hali_UBYT_usul_esaslari.pdf,PDF,funder requirements,2026-04-24,Turkey committee and case-file pilot,data/Turkey/raw documentation/source notes/Turkey deep-dive sources.md,"Publication-incentive procedure linking suspected ethics breaches and retractions to AYEK review and repayment consequences; not a public case archive."
TR-S032,Turkey,Necmettin Erbakan University ethics review and precedent hub,https://erbakan.edu.tr/tr/birim/hukuk-musavirligi/sayfa/etik-kurul-inceleme-islemleri-emsal-mahkeme-kararlari-ve-yonergeler,Website,institutional procedures,2026-04-24,Turkey committee and case-file pilot,data/Turkey/raw documentation/source notes/Turkey deep-dive sources.md,"Official legal-office hub with ethics-review examples, local and YOK directives, and precedent court-decision files; a micro-publication source rather than a live case archive."
TR-S033,Turkey,Necmettin Erbakan University ethics committee review examples,https://erbakan.edu.tr/storage/departments/files/79999903/ET%C4%B0K%20%C4%B0HLAL%20DOK%C3%9CMANLARI/6-%20ET%C4%B0K%20KURUL%20%C4%B0NCELEME%20%C3%96RNEKLER%C4%B0.pdf,PDF,institutional procedures,2026-04-24,Turkey committee and case-file pilot,data/Turkey/raw documentation/source notes/Turkey deep-dive sources.md,"Official university-hosted example material for ethics committee review; procedural case-like source, not a decision archive."
TR-S034,Turkey,Necmettin Erbakan University plagiarism complaint-standing precedent,https://erbakan.edu.tr/storage/departments/files/79999903/ET%C4%B0K%20%C4%B0HLAL%20DOK%C3%9CMANLARI/3-%20%28EMSAL%20KARAR%29%20%C4%B0NT%C4%B0HAL%20SU%C3%87UNDA%20SORU%C5%9ETURMA%20A%C3%87ILAB%C4%B0LMES%C4%B0%20%C4%B0%C3%87%C4%B0N%2C%20ESER%20SAH%C4%B0B%C4%B0M%C4%B0%20%C5%9E%C4%B0KAYET%C3%87%C4%B0%20OLMALI%20MI.pdf,PDF,transparency and case publication,2026-04-24,Turkey committee and case-file pilot,data/Turkey/raw documentation/source notes/Turkey deep-dive sources.md,"University-hosted Council of State precedent on whether the work owner must be complainant in plagiarism-related proceedings; case-law visibility rather than local finding publication."
TR-S035,Turkey,Necmettin Erbakan University plagiarism limitation-period precedent,https://erbakan.edu.tr/storage/departments/files/79999903/ET%C4%B0K%20%C4%B0HLAL%20DOK%C3%9CMANLARI/4-%20%28EMSAL%20KARAR%29%20%C4%B0NT%C4%B0HAL%20SU%C3%87UNDA%20ZAMANA%C5%9EIMINA%20DA%C4%B0R%20KARAR.pdf,PDF,transparency and case publication,2026-04-24,Turkey committee and case-file pilot,data/Turkey/raw documentation/source notes/Turkey deep-dive sources.md,"University-hosted Council of State precedent on limitation-period treatment in plagiarism-related proceedings; useful institutional micro-publication evidence."
TR-S036,Turkey,GIBTU science and engineering ethics board principles,https://www.gibtu.edu.tr/fmbetikkurul/icerik/30821,Website,institutional procedures,2026-04-24,Turkey committee and case-file pilot,data/Turkey/raw documentation/source notes/Turkey deep-dive sources.md,"Current 28 August 2025 local board page stating review and decision powers under the YOK and university directives, including application-triggered and ex officio review."
TR-S037,Turkey,GIBTU science and engineering ethics board meeting dates,https://www.gibtu.edu.tr/fmbetikkurul/icerik/30822,Website,institutional procedures,2026-04-24,Turkey committee and case-file pilot,data/Turkey/raw documentation/source notes/Turkey deep-dive sources.md,"Current 28 August 2025 local board page stating monthly meetings when applications exist and possible extraordinary meetings."
